{
  "$schema": "https://json-schema.org/draft/2020-12/schema",
  "$id": "https://yomineko.dev/contracts/topic.schema.json",
  "title": "topic",
  "description": "A block of lessons that closes one theme, and the items it unlocks.",
  "x-yomineko": {
    "entity": "topic",
    "records": 52,
    "packing": "single",
    "glob": "course/*/topic-*/topic.json",
    "stable_id_field": "id",
    "generated_by": "scripts/contracts/build_schemas.py from contracts/_shapes.json",
    "vocabulary_policy": "Types, nesting and `required` are measured from the data. Value sets are not: every `enum` here is either declared in a design document, parsed from the code that produces the value, or curated in build_schemas.py with its source named in x-vocabulary. See contracts/README.md."
  },
  "type": "object",
  "properties": {
    "created_by": {
      "$ref": "common.schema.json#/$defs/Provenance/properties/created_by"
    },
    "family_ids": {
      "type": "array",
      "items": {
        "$ref": "common.schema.json#/$defs/StableId"
      }
    },
    "id": {
      "$ref": "common.schema.json#/$defs/StableId"
    },
    "layer": {
      "$ref": "common.schema.json#/$defs/Layer"
    },
    "lessons": {
      "type": "array",
      "items": {
        "type": "object",
        "properties": {
          "description": {
            "$ref": "common.schema.json#/$defs/LocaleText"
          },
          "id": {
            "$ref": "common.schema.json#/$defs/StableId"
          },
          "needs": {
            "type": "array",
            "items": {
              "type": "object",
              "properties": {
                "note": {
                  "type": "string"
                },
                "ref": {
                  "type": "string"
                },
                "type": {
                  "type": "string",
                  "enum": [
                    "lesson"
                  ],
                  "x-vocabulary": {
                    "owner": "measured",
                    "source": "contracts/_shapes.json — no design document or producer owns this field, and the observed set is small, closed and free of prose, ids and paths."
                  }
                }
              }
            }
          },
          "order": {
            "type": "integer",
            "minimum": 0
          },
          "path": {
            "type": "string",
            "minLength": 1,
            "pattern": "^[A-Za-z0-9._-]+(/[A-Za-z0-9._-]+)*$",
            "description": "A repository-relative path to the referenced file."
          },
          "title": {
            "$ref": "common.schema.json#/$defs/LocaleText"
          },
          "unlocks": {
            "type": "array",
            "items": {
              "type": "object",
              "properties": {
                "ref": {
                  "type": "string"
                },
                "type": {
                  "type": "string",
                  "enum": [
                    "conjugation-form",
                    "feature",
                    "grammar",
                    "kana-family",
                    "kanji",
                    "kanji-family",
                    "phrase",
                    "srs-deck",
                    "vocab"
                  ],
                  "description": "What kind of item this lesson makes available. Vocabulary owner: design — design/unlock_enums.json#unlock_type. Widening it is an edit there, never a side effect of regenerating this schema from the data.",
                  "x-vocabulary": {
                    "owner": "design",
                    "source": "design/unlock_enums.json#unlock_type"
                  }
                }
              }
            }
          }
        },
        "additionalProperties": false
      }
    },
    "level": {
      "$ref": "common.schema.json#/$defs/Level"
    },
    "needs_review": {
      "$ref": "common.schema.json#/$defs/Provenance/properties/needs_review"
    },
    "objectives": {
      "type": "array",
      "items": {
        "$ref": "common.schema.json#/$defs/LocaleText"
      }
    },
    "order": {
      "type": "integer",
      "minimum": 0
    },
    "review_status": {
      "type": "array",
      "description": "Human review verdicts that are still LIVE for this record: each one's content hash still matches the text it approved. Written by the exporter from research/derived/review_ledger.json, never by hand — an entry whose text was rewritten afterwards is stale and exports nothing, and a review_status the ledger does not justify is a hard failure (scripts/validate/validate_review_ledger.py). Absent on a record nobody has reviewed, which is why it is never required. See design/review_ledger.md.",
      "items": {
        "type": "object",
        "properties": {
          "field": {
            "type": "string",
            "minLength": 1,
            "description": "The reviewed field, or \"*\" for the whole record."
          },
          "locale": {
            "anyOf": [
              {
                "$ref": "common.schema.json#/$defs/Locale"
              },
              {
                "type": "null"
              }
            ],
            "description": "The locale reviewed; null for a locale-agnostic verdict."
          },
          "status": {
            "type": "string",
            "enum": [
              "approved",
              "rejected"
            ],
            "description": "The verdict a named reviewer recorded. Vocabulary owner: design — design/review_ledger.md. Widening it is an edit there, never a side effect of regenerating this schema from the data.",
            "x-vocabulary": {
              "owner": "design",
              "source": "design/review_ledger.md"
            }
          },
          "reviewed_by": {
            "type": "string",
            "minLength": 1,
            "description": "Who reviewed it. An anonymous approval is not a review, and the correction-rate metric is per person."
          },
          "approved_at": {
            "type": "string",
            "minLength": 1,
            "description": "When. Provenance and ordering only — approvals do not expire (APP_PLAN D4): a rewrite invalidates them, the calendar does not."
          },
          "content_hash": {
            "type": "string",
            "pattern": "^(sha256:)?[0-9a-fA-F]{8,64}$",
            "description": "The sha256 of exactly what was reviewed, so a reader can tell WHICH text was approved without the ledger."
          }
        },
        "required": [
          "field",
          "status",
          "reviewed_by",
          "approved_at",
          "content_hash"
        ],
        "additionalProperties": false
      }
    },
    "source": {
      "$ref": "common.schema.json#/$defs/Provenance/properties/source"
    },
    "theme": {
      "type": "string",
      "description": "Free thematic label for the topic. No declared taxonomy."
    },
    "title": {
      "$ref": "common.schema.json#/$defs/LocaleText"
    }
  },
  "additionalProperties": false,
  "required": [
    "created_by",
    "family_ids",
    "id",
    "layer",
    "lessons",
    "level",
    "needs_review",
    "objectives",
    "order",
    "source",
    "theme",
    "title"
  ]
}
