{
  "id": "top:n5-adjetivos",
  "order": 13,
  "level": "n5",
  "title": {
    "pt-BR": "Adjetivos い e な"
  },
  "theme": "descrever",
  "objectives": [
    {
      "pt-BR": "Descrever pessoas e coisas com adjetivos い e な (presente/passado/negativo)"
    },
    {
      "pt-BR": "Expressar gostos com 好き/上手 + が"
    }
  ],
  "family_ids": [
    "grp:i-adj",
    "grp:na-adj",
    "grp:suru-irregular",
    "grp:gram-n5-adjetivos",
    "grp:word-4e00",
    "grp:word-4e08",
    "grp:word-4e0a",
    "grp:word-4e0b",
    "grp:word-4eca",
    "grp:word-4f55",
    "grp:word-4f59",
    "grp:word-5143",
    "grp:word-5168",
    "grp:word-5371",
    "grp:word-53ef",
    "grp:word-540c",
    "grp:word-540d",
    "grp:word-5916",
    "grp:word-591a",
    "grp:word-5927",
    "grp:word-5982",
    "grp:word-5acc",
    "grp:word-5c0f",
    "grp:word-5c11",
    "grp:word-5f8c",
    "grp:word-60aa",
    "grp:word-6599",
    "grp:word-65b0",
    "grp:word-660e",
    "grp:word-6696",
    "grp:word-6697",
    "grp:word-672c",
    "grp:word-6c5a",
    "grp:word-71b1",
    "grp:word-75db",
    "grp:word-767d",
    "grp:word-7d50",
    "grp:word-7f8e",
    "grp:kanji-topic-n5-adjetivos",
    "grp:word-8272",
    "grp:word-8d64",
    "grp:word-8f9b",
    "grp:word-9045",
    "grp:word-91cd",
    "grp:word-9752",
    "grp:word-9762",
    "grp:word-9ec4",
    "grp:word-9ed2"
  ],
  "lessons": [
    {
      "id": "les:n5-adjetivos-01",
      "order": 1,
      "title": {
        "pt-BR": "Adjetivos い e な: o básico para descrever"
      },
      "description": {
        "pt-BR": "As duas grandes classes de adjetivos do japonês. Você aprende a reconhecer um adjetivo-い (termina em い e já carrega tempo) e um adjetivo-な (comporta-se quase como substantivo), além de intensificar qualquer descrição com とても (muito). Começamos com cores e qualidades simples para descrever pessoas e coisas no presente afirmativo."
      },
      "path": "topic-13-adjetivos/lesson-01.json",
      "needs": [
        {
          "type": "lesson",
          "ref": "les:n5-passado-03",
          "note": "Apresenta a palavra 大きい (おおきい), e os pontos de gramática い-adjectives e ね, que aparecem nesta lição."
        }
      ],
      "unlocks": [
        {
          "type": "grammar",
          "ref": "gram:na-adjectives"
        },
        {
          "type": "grammar",
          "ref": "gram:totemo"
        },
        {
          "type": "kanji",
          "ref": "kanji:小"
        },
        {
          "type": "vocab",
          "ref": "vocab:1260720"
        },
        {
          "type": "vocab",
          "ref": "vocab:1347750"
        },
        {
          "type": "vocab",
          "ref": "vocab:1474900"
        },
        {
          "type": "vocab",
          "ref": "vocab:1474910"
        },
        {
          "type": "vocab",
          "ref": "vocab:1591900"
        },
        {
          "type": "vocab",
          "ref": "vocab:1486650"
        },
        {
          "type": "vocab",
          "ref": "vocab:1587850"
        },
        {
          "type": "vocab",
          "ref": "vocab:2013900"
        },
        {
          "type": "vocab",
          "ref": "vocab:1383240"
        },
        {
          "type": "vocab",
          "ref": "vocab:1381380"
        },
        {
          "type": "vocab",
          "ref": "vocab:1381390"
        },
        {
          "type": "vocab",
          "ref": "vocab:1381820"
        },
        {
          "type": "vocab",
          "ref": "vocab:1576760"
        },
        {
          "type": "vocab",
          "ref": "vocab:1182030"
        },
        {
          "type": "vocab",
          "ref": "vocab:1287410"
        },
        {
          "type": "vocab",
          "ref": "vocab:1287420"
        }
      ]
    },
    {
      "id": "les:n5-adjetivos-02",
      "order": 2,
      "title": {
        "pt-BR": "Qualidades do dia a dia e o irregular いい"
      },
      "description": {
        "pt-BR": "Ampliamos o vocabulário descritivo com adjetivos-い de temperatura, sabor e tamanho, e apresentamos いい (bom); o adjetivo mais útil e mais irregular do japonês, cuja raiz vira よ- em quase todas as flexões. Inclui o par de leitura 良い (よい), a forma escrita de いい."
      },
      "path": "topic-13-adjetivos/lesson-02.json",
      "needs": [
        {
          "type": "lesson",
          "ref": "les:n5-adjetivos-01",
          "note": "Apresenta a palavra 美味しい (おいしい), que aparece nesta lição."
        },
        {
          "type": "lesson",
          "ref": "les:n5-particulas-lugar-06",
          "note": "Apresenta a palavra 良い (よい), que aparece nesta lição."
        }
      ],
      "unlocks": [
        {
          "type": "grammar",
          "ref": "gram:gp-5"
        },
        {
          "type": "grammar",
          "ref": "gram:temo-ii-desu"
        },
        {
          "type": "vocab",
          "ref": "vocab:1275320"
        },
        {
          "type": "vocab",
          "ref": "vocab:1577200"
        },
        {
          "type": "vocab",
          "ref": "vocab:1361490"
        },
        {
          "type": "vocab",
          "ref": "vocab:1343460"
        },
        {
          "type": "vocab",
          "ref": "vocab:1586420"
        },
        {
          "type": "vocab",
          "ref": "vocab:1523060"
        },
        {
          "type": "vocab",
          "ref": "vocab:1554370"
        },
        {
          "type": "vocab",
          "ref": "vocab:1467720"
        },
        {
          "type": "vocab",
          "ref": "vocab:1213400"
        },
        {
          "type": "vocab",
          "ref": "vocab:1475480"
        },
        {
          "type": "vocab",
          "ref": "vocab:1252560"
        },
        {
          "type": "vocab",
          "ref": "vocab:1365850"
        },
        {
          "type": "vocab",
          "ref": "vocab:1335750"
        },
        {
          "type": "vocab",
          "ref": "vocab:1533580"
        }
      ]
    },
    {
      "id": "les:n5-adjetivos-03",
      "order": 3,
      "title": {
        "pt-BR": "Dizendo o que NÃO é: negativo dos adjetivos-い"
      },
      "description": {
        "pt-BR": "A forma negativa dos adjetivos-い troca o い final por くない (高い → 高くない, 'não é caro'). É a base informal; acrescente です para soar polido. Praticamos com pares de opostos e adjetivos de avaliação para negar qualidades de pessoas, lugares e coisas."
      },
      "path": "topic-13-adjetivos/lesson-03.json",
      "needs": [
        {
          "type": "lesson",
          "ref": "les:n5-perguntas-05",
          "note": "Apresenta os kanji 学 e 校, que aparecem nesta lição."
        },
        {
          "type": "lesson",
          "ref": "les:n5-verbos-03",
          "note": "Apresenta o kanji 行 e a palavra 行く (いく), que aparecem nesta lição."
        }
      ],
      "unlocks": [
        {
          "type": "conjugation-form",
          "ref": "conj:polite-negative"
        },
        {
          "type": "grammar",
          "ref": "gram:gp-24"
        },
        {
          "type": "vocab",
          "ref": "vocab:1218380"
        },
        {
          "type": "vocab",
          "ref": "vocab:1407460"
        },
        {
          "type": "vocab",
          "ref": "vocab:1348910"
        },
        {
          "type": "vocab",
          "ref": "vocab:1519290"
        },
        {
          "type": "vocab",
          "ref": "vocab:1151260"
        },
        {
          "type": "vocab",
          "ref": "vocab:1532350"
        },
        {
          "type": "vocab",
          "ref": "vocab:1154330"
        },
        {
          "type": "vocab",
          "ref": "vocab:1178940"
        },
        {
          "type": "vocab",
          "ref": "vocab:1481920"
        },
        {
          "type": "vocab",
          "ref": "vocab:1237680"
        },
        {
          "type": "vocab",
          "ref": "vocab:1432680"
        },
        {
          "type": "vocab",
          "ref": "vocab:1421970"
        }
      ]
    },
    {
      "id": "les:n5-adjetivos-04",
      "order": 4,
      "title": {
        "pt-BR": "Como era antes: passado negativo dos adjetivos-い"
      },
      "description": {
        "pt-BR": "Depois do negativo presente, vem o passado negativo dos adjetivos-い: a terminação くない vira くなかった (高くなかった, \"não estava caro\"). Fechamos o quadro de flexão do adjetivo-い e revisamos adjetivos já vistos no tempo passado, com vocabulário de avaliação e palavras de quantidade."
      },
      "path": "topic-13-adjetivos/lesson-04.json",
      "needs": [
        {
          "type": "lesson",
          "ref": "les:n5-adjetivos-02",
          "note": "Apresenta as palavras 甘い (あまい) e 面白い (おもしろい), que aparecem nesta lição."
        },
        {
          "type": "lesson",
          "ref": "les:n5-adjetivos-03",
          "note": "Apresenta a palavra 忙しい (いそがしい), que aparece nesta lição."
        }
      ],
      "unlocks": [
        {
          "type": "grammar",
          "ref": "gram:gp-35"
        },
        {
          "type": "vocab",
          "ref": "vocab:1165970"
        },
        {
          "type": "vocab",
          "ref": "vocab:1580480"
        },
        {
          "type": "vocab",
          "ref": "vocab:1188890"
        },
        {
          "type": "vocab",
          "ref": "vocab:1584930"
        },
        {
          "type": "vocab",
          "ref": "vocab:1396130"
        },
        {
          "type": "vocab",
          "ref": "vocab:1451750"
        },
        {
          "type": "vocab",
          "ref": "vocab:1414150"
        },
        {
          "type": "vocab",
          "ref": "vocab:1414340"
        },
        {
          "type": "vocab",
          "ref": "vocab:2845606"
        },
        {
          "type": "vocab",
          "ref": "vocab:1254760"
        }
      ]
    },
    {
      "id": "les:n5-adjetivos-05",
      "order": 5,
      "title": {
        "pt-BR": "Como acontece e o que vira: ～く advérbio e なる (tornar-se)"